{
  "$schema": "https://json-schema.org/draft/2020-12/schema",
  "$id": "https://lesser.host/spec/v3/schemas/soul-comm-status.response.schema.json",
  "title": "GET /api/v1/soul/comm/status/{messageId} response",
  "type": "object",
  "additionalProperties": false,
  "required": ["messageId", "status", "channel", "agentId", "to", "createdAt"],
  "properties": {
    "messageId": { "type": "string", "minLength": 1, "maxLength": 128 },
    "status": { "type": "string", "enum": ["accepted", "sent", "failed"] },
    "channel": { "type": "string", "enum": ["email", "sms", "voice"] },
    "agentId": { "type": "string", "pattern": "^0x[0-9a-fA-F]{64}$" },
    "to": { "type": "string", "minLength": 3, "maxLength": 512 },
    "provider": { "type": "string", "minLength": 1, "maxLength": 64 },
    "providerMessageId": { "type": "string", "minLength": 1, "maxLength": 256 },
    "errorCode": { "type": "string", "minLength": 1, "maxLength": 128 },
    "errorMessage": { "type": "string", "minLength": 1, "maxLength": 2048 },
    "replyMessageId": { "type": "string", "minLength": 1, "maxLength": 256 },
    "replyBody": { "type": "string", "minLength": 1, "maxLength": 4096 },
    "replyConfidence": { "type": "number", "minimum": 0, "maximum": 1 },
    "replyReceivedAt": { "type": "string", "format": "date-time" },
    "actedBy": {
      "type": "string",
      "pattern": "^[a-z0-9_-]{1,30}$",
      "maxLength": 30,
      "description": "Caller-attribution actedBy value persisted with the send record, echoed when present. Attribution only, never authorization."
    },
    "createdAt": { "type": "string", "format": "date-time" },
    "updatedAt": { "type": "string", "format": "date-time" }
  }
}
