{
  "messageId": "comm-out-001",
  "status": "sent",
  "channel": "email",
  "agentId": "0x2222222222222222222222222222222222222222222222222222222222222222",
  "to": "alice@example.com",
  "provider": "migadu",
  "providerMessageId": "migadu:abc123",
  "createdAt": "2026-03-04T12:00:05Z",
  "updatedAt": "2026-03-04T12:00:06Z"
}
